<?xml version="1.0" encoding="UTF-8"?>

<danielpm1982:consultationRecord
	xmlns:xsi="http://www.w3.org/2001/XMLSchema-instance"
	xsi:schemaLocation="http://www.danielpm1982.com/consultationRecord ConsultationRecord.xsd"
	xmlns:danielpm1982="http://www.danielpm1982.com/consultationRecord"
	danielpm1982:consultationRecordId="1700">
	<danielpm1982:patient danielpm1982:patientId="300">
		<danielpm1982:name>Patient ABC</danielpm1982:name>
		<danielpm1982:gender>male</danielpm1982:gender>
		<danielpm1982:birthDate>1950-10-01</danielpm1982:birthDate>
		<danielpm1982:email>patientabc@patient.com</danielpm1982:email>
		<danielpm1982:address>5th street, 4th neighborhood, city X, state Y, country Z</danielpm1982:address>
		<danielpm1982:phoneNumber>9198165165</danielpm1982:phoneNumber>
		<danielpm1982:phoneNumber>5455454546</danielpm1982:phoneNumber>
	</danielpm1982:patient>
	<danielpm1982:clinician danielpm1982:clinicianId="12">
		<danielpm1982:professionalNumber>3335</danielpm1982:professionalNumber>
		<danielpm1982:profession>pharmacistDoctor</danielpm1982:profession>
		<danielpm1982:name>Pharmacist DEF</danielpm1982:name>
		<danielpm1982:gender>female</danielpm1982:gender>
		<danielpm1982:email>pharmacistdef@clinician.com</danielpm1982:email>
		<danielpm1982:phoneNumber>45657987984</danielpm1982:phoneNumber>
	</danielpm1982:clinician>
	<danielpm1982:consultation>
		<danielpm1982:dateTime>2019-02-05T14:00:00</danielpm1982:dateTime>
		<danielpm1982:diagnosis>Correct diagnosis. New lab pharmaceutical pathology exams solicited and analysed. Good results.</danielpm1982:diagnosis>
		<danielpm1982:diagnosis>Pharmaceutical treatment appropriate, although optimization/individual necessities detected</danielpm1982:diagnosis>
		<danielpm1982:diagnosis>Lack of understanding of the medications</danielpm1982:diagnosis>
		<danielpm1982:diagnosis>Failure to receive the full benefit of prescribed therapy</danielpm1982:diagnosis>
		<danielpm1982:diagnosis>Failure of the patient to adhere to the regimen</danielpm1982:diagnosis>
		<danielpm1982:intervention>New more effective drugs and with new posologies prescribed by the Clinical Pharmacist for better adjustment of pharmacokinetics results, better clinical response and easier adherence from the patient to the treatment</danielpm1982:intervention>
		<danielpm1982:intervention>Pharmaceutical deprescription of no longer needed drugs</danielpm1982:intervention>
		<danielpm1982:intervention>Patient re-oriented about all his conditions, correct care management and pharmaceutical issues related to drugs efficacy and security</danielpm1982:intervention>
		<danielpm1982:intervention>Continuous Clinical Pharmaceutical Consultations scheduled</danielpm1982:intervention>
		<danielpm1982:intervention>All other clinicians notified. No referrals needed.</danielpm1982:intervention>
		<danielpm1982:intervention>Clinical Pharmaceutical consultation documented and registered at the patient Health Record</danielpm1982:intervention>
	</danielpm1982:consultation>
</danielpm1982:consultationRecord>
